{
  "$schema": "http://json-schema.org/draft-07/schema#",
  "$id": "plan-manifests/plan-manifest.schema.json",
  "title": "Plan Manifest Schema",
  "description": "JSON Schema for validating plan manifest files used in the OpenCode agent pipeline. Validates structural, behavioral, meta, and acceptance checkpoints alongside contract rules.",
  "type": "object",
  "additionalProperties": false,
  "required": [
    "manifestVersion",
    "planSummary",
    "createdAt",
    "checkpoints"
  ],
  "properties": {
    "manifestVersion": {
      "description": "Version number of the manifest format. Increment when schema-breaking changes are made. Use 1 for initial manifests.",
      "type": "integer",
      "minimum": 1
    },
    "planSummary": {
      "description": "Brief human-readable description of the overall plan.",
      "type": "string",
      "minLength": 1
    },
    "createdAt": {
      "description": "ISO-8601 timestamp indicating when the manifest was created.",
      "type": "string",
      "format": "date-time"
    },
    "feature": {
      "description": "Short identifier or name for the feature being implemented.",
      "type": "string",
      "minLength": 1
    },
    "phases": {
      "description": "Number of phases in the implementation roadmap.",
      "type": "integer",
      "minimum": 1
    },
    "estimatedEffort": {
      "description": "Estimated effort level for the implementation.",
      "type": "string",
      "enum": ["small", "medium", "large", "x-large"]
    },
    "riskLevel": {
      "description": "Estimated risk level for the implementation.",
      "type": "string",
      "enum": ["low", "medium", "high"]
    },
    "changes": {
      "description": "List of changes from the previous manifest version. Used for manifest diffing across versions. Omit or set to empty array for the first manifest version.",
      "type": "array",
      "items": {
        "type": "object",
        "additionalProperties": false,
        "required": ["from", "to", "description"],
        "properties": {
          "from": {
            "description": "Source checkpoint ID that was changed.",
            "type": "string",
            "pattern": "^CP-\\d{3}$"
          },
          "to": {
            "description": "Target checkpoint ID after the change.",
            "type": "string",
            "pattern": "^CP-\\d{3}$"
          },
          "description": {
            "description": "Human-readable description of what changed and why.",
            "type": "string",
            "minLength": 1
          }
        }
      },
      "uniqueItems": true
    },
    "contractRules": {
      "description": "Machine-executable rules that constrain what the Implementor can and cannot do. Every manifest MUST have at least 3 contract rules per file being modified.",
      "type": "array",
      "items": {
        "$ref": "#/definitions/contractRule"
      },
      "uniqueItems": true
    },
    "checkpoints": {
      "description": "Ordered list of quality checkpoints that verify the implementation matches the plan. Structural checkpoints first, then behavioral, meta, and acceptance checkpoints.",
      "type": "array",
      "items": {
        "$ref": "#/definitions/checkpoint"
      },
      "uniqueItems": true,
      "minItems": 1
    }
  },
  "definitions": {
    "contractRule": {
      "type": "object",
      "additionalProperties": false,
      "required": [
        "id",
        "type",
        "severity",
        "description",
        "rule",
        "expectedResult"
      ],
      "properties": {
        "id": {
          "description": "Unique identifier for the contract rule following the pattern CR-NNN.",
          "type": "string",
          "pattern": "^CR-\\d{3}$"
        },
        "type": {
          "description": "The category of the contract rule.",
          "type": "string",
          "enum": [
            "import_restriction",
            "import_required",
            "library_restriction",
            "method_must_exist",
            "pattern_must_exist",
            "pattern_forbidden",
            "naming_convention"
          ]
        },
        "severity": {
          "description": "Severity level of the rule violation. Blocking rules stop the pipeline; warnings are non-blocking.",
          "type": "string",
          "enum": ["blocking", "warning"]
        },
        "description": {
          "description": "Human-readable explanation of what the rule enforces.",
          "type": "string",
          "minLength": 1
        },
        "rule": {
          "description": "Shell command to execute for verifying the rule (e.g., a grep command).",
          "type": "string",
          "minLength": 1
        },
        "expectedResult": {
          "description": "Expected outcome of executing the rule. 'no_matches' means the rule command should find zero results. 'matches_found' means the rule command must find at least one result.",
          "type": "string",
          "enum": ["no_matches", "matches_found"]
        }
      }
    },
    "checkpoint": {
      "type": "object",
      "additionalProperties": false,
      "required": [
        "id",
        "type",
        "description",
        "target",
        "verify"
      ],
      "properties": {
        "id": {
          "description": "Unique identifier for the checkpoint following the pattern CP-NNN.",
          "type": "string",
          "pattern": "^CP-\\d{3}$"
        },
        "type": {
          "description": "The category of checkpoint determining what kind of verification is performed.",
          "type": "string",
          "enum": ["structural", "behavioral", "meta", "acceptance"]
        },
        "description": {
          "description": "Human-readable description of what to verify.",
          "type": "string",
          "minLength": 1
        },
        "target": {
          "description": "Relative file path to the file being verified (e.g., 'src/services/user.ts').",
          "type": "string",
          "minLength": 1
        },
        "dependsOn": {
          "description": "Array of checkpoint IDs that must pass before this checkpoint can be verified. Expresses ordering dependencies.",
          "type": "array",
          "items": {
            "type": "string",
            "pattern": "^CP-\\d{3}$"
          },
          "uniqueItems": true
        },
        "acceptanceCriteria": {
          "description": "Optional acceptance criteria string describing the condition that must be met for this checkpoint to pass.",
          "type": "string",
          "minLength": 1
        },
        "verify": {
          "description": "Verification specification. The structure depends on the 'kind' field, which determines which additional fields are required.",
          "type": "object",
          "additionalProperties": false,
          "required": ["kind"],
          "properties": {
            "kind": {
              "description": "The type of verification to perform.",
              "type": "string",
              "enum": [
                "fileExists",
                "fileNotExists",
                "exportExists",
                "classExists",
                "functionExists",
                "methodExists",
                "typeExists",
                "routeExists",
                "handlesError",
                "validatesInput",
                "logsAtLevel",
                "hasMiddleware",
                "selfReviewCheckpoint",
                "acceptanceCriteria"
              ]
            },
            "exportName": {
              "description": "Required when kind is 'exportExists'. The name of the export to verify.",
              "type": "string",
              "minLength": 1
            },
            "className": {
              "description": "Required when kind is 'classExists' or 'methodExists'. The class name to verify.",
              "type": "string",
              "minLength": 1
            },
            "functionName": {
              "description": "Required when kind is 'functionExists'. The function name to verify.",
              "type": "string",
              "minLength": 1
            },
            "methodName": {
              "description": "Required when kind is 'methodExists', 'handlesError', or 'validatesInput'. The method name to verify.",
              "type": "string",
              "minLength": 1
            },
            "typeName": {
              "description": "Required when kind is 'typeExists'. The type or interface name to verify.",
              "type": "string",
              "minLength": 1
            },
            "routePath": {
              "description": "Required when kind is 'routeExists' or 'hasMiddleware'. The API route path (e.g., '/api/users').",
              "type": "string",
              "minLength": 1
            },
            "method": {
              "description": "Required when kind is 'routeExists' or 'hasMiddleware'. The HTTP method (GET, POST, PUT, DELETE, PATCH).",
              "type": "string",
              "enum": ["GET", "POST", "PUT", "DELETE", "PATCH"]
            },
            "details": {
              "description": "Required when kind is 'handlesError'. Description of the error scenario to verify.",
              "type": "string",
              "minLength": 1
            },
            "level": {
              "description": "Required when kind is 'logsAtLevel'. The logging level to verify.",
              "type": "string",
              "enum": ["info", "warn", "error", "debug"]
            },
            "middlewareName": {
              "description": "Required when kind is 'hasMiddleware'. The name of the middleware function to verify.",
              "type": "string",
              "minLength": 1
            },
            "prompt": {
              "description": "Required when kind is 'selfReviewCheckpoint'. Description of what the Implementor should self-verify.",
              "type": "string",
              "minLength": 1
            },
            "verifyMethod": {
              "description": "Required when kind is 'selfReviewCheckpoint'. The method to use for verification.",
              "type": "string",
              "enum": ["grep", "read", "reason"]
            },
            "given": {
              "description": "Required when kind is 'acceptanceCriteria'. The precondition or setup for the test scenario.",
              "type": "string",
              "minLength": 1
            },
            "when": {
              "description": "Required when kind is 'acceptanceCriteria'. The action or trigger for the test scenario.",
              "type": "string",
              "minLength": 1
            },
            "then": {
              "description": "Required when kind is 'acceptanceCriteria'. The expected outcome of the test scenario.",
              "type": "string",
              "minLength": 1
            },
            "testCommand": {
              "description": "Required when kind is 'acceptanceCriteria'. Shell command that exits with code 0 on success.",
              "type": "string",
              "minLength": 1
            }
          },
          "allOf": [
            {
              "description": "Conditional validation for structural checkpoint kinds requiring additional fields.",
              "if": {
                "properties": { "kind": { "const": "exportExists" } },
                "required": ["kind"]
              },
              "then": {
                "required": ["exportName"]
              }
            },
            {
              "if": {
                "properties": { "kind": { "const": "classExists" } },
                "required": ["kind"]
              },
              "then": {
                "required": ["className"]
              }
            },
            {
              "if": {
                "properties": { "kind": { "const": "functionExists" } },
                "required": ["kind"]
              },
              "then": {
                "required": ["functionName"]
              }
            },
            {
              "if": {
                "properties": { "kind": { "const": "methodExists" } },
                "required": ["kind"]
              },
              "then": {
                "required": ["className", "methodName"]
              }
            },
            {
              "if": {
                "properties": { "kind": { "const": "typeExists" } },
                "required": ["kind"]
              },
              "then": {
                "required": ["typeName"]
              }
            },
            {
              "if": {
                "properties": { "kind": { "const": "routeExists" } },
                "required": ["kind"]
              },
              "then": {
                "required": ["routePath", "method"]
              }
            },
            {
              "description": "Conditional validation for behavioral checkpoint kinds requiring additional fields.",
              "if": {
                "properties": { "kind": { "const": "handlesError" } },
                "required": ["kind"]
              },
              "then": {
                "required": ["methodName", "details"]
              }
            },
            {
              "if": {
                "properties": { "kind": { "const": "validatesInput" } },
                "required": ["kind"]
              },
              "then": {
                "required": ["methodName"]
              }
            },
            {
              "if": {
                "properties": { "kind": { "const": "logsAtLevel" } },
                "required": ["kind"]
              },
              "then": {
                "required": ["level"]
              }
            },
            {
              "if": {
                "properties": { "kind": { "const": "hasMiddleware" } },
                "required": ["kind"]
              },
              "then": {
                "required": ["middlewareName", "routePath", "method"]
              }
            },
            {
              "description": "Conditional validation for meta checkpoint kinds requiring additional fields.",
              "if": {
                "properties": { "kind": { "const": "selfReviewCheckpoint" } },
                "required": ["kind"]
              },
              "then": {
                "required": ["prompt", "verifyMethod"]
              }
            },
            {
              "description": "Conditional validation for acceptance criteria checkpoint kinds.",
              "if": {
                "properties": { "kind": { "const": "acceptanceCriteria" } },
                "required": ["kind"]
              },
              "then": {
                "required": ["given", "when", "then", "testCommand"]
              }
            }
          ]
        }
      }
    }
  }
}